{
  "schemaVersion": "1.0.0",
  "metadata": {
    "title": "Jeffrey Yang",
    "language": "en-US"
  },
  "contact": {
    "location": "Los Angeles, CA",
    "email": "jeffreydavidyang@gmail.com",
    "phone": "626-818-2618",
    "profiles": [
      {
        "id": "github",
        "label": "GitHub",
        "display": "github.com/jeffreyyang3",
        "url": "https://github.com/jeffreyyang3"
      },
      {
        "id": "linkedin",
        "label": "LinkedIn",
        "display": "linkedin.com/in/jeffreyyang3",
        "url": "https://www.linkedin.com/in/jeffreyyang3"
      }
    ]
  },
  "summary": "Senior software engineer with 5+ years of full-stack experience across consumer and enterprise products.",
  "experience": [
    {
      "id": "celonis",
      "company": "Celonis",
      "title": "Senior Software Engineer",
      "location": "Los Angeles, CA",
      "startDate": "2023-01",
      "endDate": null,
      "promotedAt": "2025-10",
      "highlights": [
        "Owned the Celonis Knowledge Model backend: a user configuration store, and business semantic layer powering all data queries throughout the platform in non-legacy products. Java / Spring Boot",
        "Led planning, design, and implementation for product features and engineering initiatives. Coordinated discussion, work and prioritization across multiple engineering teams, product areas, countries",
        "Heavily utilized Claude Code and Codex for spec-driven agentic engineering, company-wide codebase research, large scale refactoring / codebase maintenance, MCPs (Datadog, Slack, Jira, and more). Created coding standards, reusable scaffolding plans, business context summaries for agents",
        "Reduced latency in main user facing product (Celonis Studio) query execution path from ~600 to ~200ms over a quarter through instrumentation, optimization, and cross-team investigation + prioritization",
        "Direct technical advisory and implementation for enterprise customers; developed custom migration tooling to enable successful retirement of a legacy product",
        "Created Jest based API testing framework with strongly typed clients, authentication, automated setup and cleanup actively used and contributed to by multiple teams",
        "Frontend feature development for Q&A based beginner-friendly business data exploration product. Angular / TypeScript",
        "Tech talks in LA, Bay Area, Munich offices: Playwright integration testing, Latency investigations, custom integration testing framework, philosophical future product and server architecture directions"
      ]
    },
    {
      "id": "opendoor",
      "company": "Opendoor",
      "title": "Software Engineer",
      "location": "Los Angeles, CA",
      "startDate": "2022-03",
      "endDate": "2022-11",
      "highlights": [
        "Full stack engineer on Opendoor's home buying experience. React, GraphQL, Ruby on Rails, Mongo.",
        "Ops-focused work on internal tools for MLS home touring and Opendoor agent experience",
        "Consumer facing mobile app (React Native) and web feature development for home browsing, tour scheduling, home unlocks",
        "Wrote design/scoping documents, led planning discussions on my features and more general future initiatives",
        "Monitoring, analytics, and analysis using Datadog, Amplitude, Optimizely, Snowflake"
      ]
    },
    {
      "id": "poshmark",
      "company": "Poshmark",
      "title": "Software Engineer",
      "location": "Redwood City, CA",
      "startDate": "2021-01",
      "endDate": "2022-02",
      "highlights": [
        "Primary frontend engineer for features including bulk closet actions, seller clienteling tools, mobile-web listing creation, and listing tags using Vue.js and Node.",
        "Produced impact estimates, technical scopes, and post-launch monitoring using clickstream data, Kibana, and Datadog.",
        "Developed web features to run inside native mobile webviews",
        "Migrated web and mobile features from Rails/jQuery SSR frontend to Vue.js"
      ]
    }
  ],
  "education": [
    {
      "id": "uc-santa-cruz",
      "institution": "University of California, Santa Cruz",
      "degree": "B.S. Computer Science",
      "graduationYear": 2020,
      "location": "Santa Cruz, CA"
    }
  ],
  "download": {
    "label": "Download Resume",
    "path": "jeffrey_yang_resume.pdf",
    "mimeType": "application/pdf"
  }
}
